{
  "baseline_sha256": "3d2c4229aa8db372acd2665d9852ebde8270932ccdcbef954a83f071619305df",
  "config": {
    "confidence_z": 2.576,
    "metrics": {
      "abstained": {
        "direction": "increase",
        "kind": "binary",
        "min_delta": 0.15,
        "signal_name": "abstention_rate"
      },
      "faithfulness": {
        "bin_edges": [
          0.0,
          0.2,
          0.4,
          0.6,
          0.8,
          1.0
        ],
        "direction": "decrease",
        "jsd_threshold": 0.1,
        "kind": "continuous",
        "min_delta": 0.1,
        "signal_name": "faithfulness"
      },
      "fallback": {
        "direction": "increase",
        "kind": "binary",
        "min_delta": 0.1,
        "signal_name": "fallback_rate"
      }
    },
    "min_baseline_samples": 50,
    "minimum_persistence_seconds": 600,
    "minimum_window_span_seconds": 1740,
    "recovery_windows": 3,
    "required_consecutive": 2,
    "stride": 10,
    "window_size": 30
  },
  "diagnostics": [],
  "generated_at_utc": "2026-07-30T12:59:10.873628Z",
  "git": {
    "dirty": false,
    "sha": "4d293e0664bd28ed2d9ad1bdf98efad7049824c8"
  },
  "input_sha256": "630b80f7dc37ec22ac9eb8da273aa475f2ea855ff4739e66c8328f27edaede45",
  "schema_version": "mandate27-report-v1",
  "signals": [],
  "status": "no_drift",
  "windows": [
    {
      "absolute_delta": 0.016666666666666677,
      "baseline_interval": [
        0.03823766682414083,
        0.17209607014447065
      ],
      "baseline_value": 0.08333333333333333,
      "breach": false,
      "consecutive_breaches": 0,
      "current_interval": [
        0.025649613897367557,
        0.31925302990086946
      ],
      "current_value": 0.1,
      "metric": "abstention_rate",
      "sample_count": 30,
      "state": "normal",
      "statistic": "wilson_interval",
      "statistic_value": -0.1464464562471031,
      "surface": "copilot",
      "threshold": 0.15,
      "window_end": "2026-07-30T00:29:00Z",
      "window_span_seconds": 1740.0,
      "window_start": "2026-07-30T00:00:00Z"
    },
    {
      "absolute_delta": 0.016666666666666677,
      "baseline_interval": [
        0.03823766682414083,
        0.17209607014447065
      ],
      "baseline_value": 0.08333333333333333,
      "breach": false,
      "consecutive_breaches": 0,
      "current_interval": [
        0.025649613897367557,
        0.31925302990086946
      ],
      "current_value": 0.1,
      "metric": "abstention_rate",
      "sample_count": 30,
      "state": "normal",
      "statistic": "wilson_interval",
      "statistic_value": -0.1464464562471031,
      "surface": "copilot",
      "threshold": 0.15,
      "window_end": "2026-07-30T00:39:00Z",
      "window_span_seconds": 1740.0,
      "window_start": "2026-07-30T00:10:00Z"
    },
    {
      "absolute_delta": 0.016666666666666677,
      "baseline_interval": [
        0.03823766682414083,
        0.17209607014447065
      ],
      "baseline_value": 0.08333333333333333,
      "breach": false,
      "consecutive_breaches": 0,
      "current_interval": [
        0.025649613897367557,
        0.31925302990086946
      ],
      "current_value": 0.1,
      "metric": "abstention_rate",
      "sample_count": 30,
      "state": "normal",
      "statistic": "wilson_interval",
      "statistic_value": -0.1464464562471031,
      "surface": "copilot",
      "threshold": 0.15,
      "window_end": "2026-07-30T00:49:00Z",
      "window_span_seconds": 1740.0,
      "window_start": "2026-07-30T00:20:00Z"
    },
    {
      "absolute_delta": -0.016666666666666663,
      "baseline_interval": [
        0.03823766682414083,
        0.17209607014447065
      ],
      "baseline_value": 0.08333333333333333,
      "breach": false,
      "consecutive_breaches": 0,
      "current_interval": [
        0.0131301538876063,
        0.2771810435604838
      ],
      "current_value": 0.06666666666666667,
      "metric": "abstention_rate",
      "sample_count": 30,
      "state": "normal",
      "statistic": "wilson_interval",
      "statistic_value": -0.15896591625686435,
      "surface": "copilot",
      "threshold": 0.15,
      "window_end": "2026-07-30T00:59:00Z",
      "window_span_seconds": 1740.0,
      "window_start": "2026-07-30T00:30:00Z"
    },
    {
      "absolute_delta": -0.016666666666666663,
      "baseline_interval": [
        0.03823766682414083,
        0.17209607014447065
      ],
      "baseline_value": 0.08333333333333333,
      "breach": false,
      "consecutive_breaches": 0,
      "current_interval": [
        0.0131301538876063,
        0.2771810435604838
      ],
      "current_value": 0.06666666666666667,
      "metric": "abstention_rate",
      "sample_count": 30,
      "state": "normal",
      "statistic": "wilson_interval",
      "statistic_value": -0.15896591625686435,
      "surface": "copilot",
      "threshold": 0.15,
      "window_end": "2026-07-30T01:09:00Z",
      "window_span_seconds": 1740.0,
      "window_start": "2026-07-30T00:40:00Z"
    },
    {
      "absolute_delta": -0.016666666666666663,
      "baseline_interval": [
        0.03823766682414083,
        0.17209607014447065
      ],
      "baseline_value": 0.08333333333333333,
      "breach": false,
      "consecutive_breaches": 0,
      "current_interval": [
        0.0131301538876063,
        0.2771810435604838
      ],
      "current_value": 0.06666666666666667,
      "metric": "abstention_rate",
      "sample_count": 30,
      "state": "normal",
      "statistic": "wilson_interval",
      "statistic_value": -0.15896591625686435,
      "surface": "copilot",
      "threshold": 0.15,
      "window_end": "2026-07-30T01:19:00Z",
      "window_span_seconds": 1740.0,
      "window_start": "2026-07-30T00:50:00Z"
    },
    {
      "absolute_delta": 0.016666666666666677,
      "baseline_interval": [
        0.03823766682414083,
        0.17209607014447065
      ],
      "baseline_value": 0.08333333333333333,
      "breach": false,
      "consecutive_breaches": 0,
      "current_interval": [
        0.025649613897367557,
        0.31925302990086946
      ],
      "current_value": 0.1,
      "metric": "abstention_rate",
      "sample_count": 30,
      "state": "normal",
      "statistic": "wilson_interval",
      "statistic_value": -0.1464464562471031,
      "surface": "copilot",
      "threshold": 0.15,
      "window_end": "2026-07-30T01:29:00Z",
      "window_span_seconds": 1740.0,
      "window_start": "2026-07-30T01:00:00Z"
    },
    {
      "absolute_delta": 0.016666666666666677,
      "baseline_interval": [
        0.03823766682414083,
        0.17209607014447065
      ],
      "baseline_value": 0.08333333333333333,
      "breach": false,
      "consecutive_breaches": 0,
      "current_interval": [
        0.025649613897367557,
        0.31925302990086946
      ],
      "current_value": 0.1,
      "metric": "abstention_rate",
      "sample_count": 30,
      "state": "normal",
      "statistic": "wilson_interval",
      "statistic_value": -0.1464464562471031,
      "surface": "copilot",
      "threshold": 0.15,
      "window_end": "2026-07-30T01:39:00Z",
      "window_span_seconds": 1740.0,
      "window_start": "2026-07-30T01:10:00Z"
    },
    {
      "absolute_delta": 0.016666666666666677,
      "baseline_interval": [
        0.03823766682414083,
        0.17209607014447065
      ],
      "baseline_value": 0.08333333333333333,
      "breach": false,
      "consecutive_breaches": 0,
      "current_interval": [
        0.025649613897367557,
        0.31925302990086946
      ],
      "current_value": 0.1,
      "metric": "abstention_rate",
      "sample_count": 30,
      "state": "normal",
      "statistic": "wilson_interval",
      "statistic_value": -0.1464464562471031,
      "surface": "copilot",
      "threshold": 0.15,
      "window_end": "2026-07-30T01:49:00Z",
      "window_span_seconds": 1740.0,
      "window_start": "2026-07-30T01:20:00Z"
    },
    {
      "absolute_delta": -0.016666666666666663,
      "baseline_interval": [
        0.03823766682414083,
        0.17209607014447065
      ],
      "baseline_value": 0.08333333333333333,
      "breach": false,
      "consecutive_breaches": 0,
      "current_interval": [
        0.0131301538876063,
        0.2771810435604838
      ],
      "current_value": 0.06666666666666667,
      "metric": "abstention_rate",
      "sample_count": 30,
      "state": "normal",
      "statistic": "wilson_interval",
      "statistic_value": -0.15896591625686435,
      "surface": "copilot",
      "threshold": 0.15,
      "window_end": "2026-07-30T01:59:00Z",
      "window_span_seconds": 1740.0,
      "window_start": "2026-07-30T01:30:00Z"
    },
    {
      "absolute_delta": 0.0,
      "baseline_value": 0.96,
      "breach": false,
      "consecutive_breaches": 0,
      "current_value": 0.96,
      "metric": "faithfulness",
      "sample_count": 30,
      "state": "normal",
      "statistic": "jensen_shannon_divergence",
      "statistic_threshold": 0.1,
      "statistic_value": 0.0,
      "surface": "copilot",
      "threshold": 0.1,
      "window_end": "2026-07-30T00:29:00Z",
      "window_span_seconds": 1740.0,
      "window_start": "2026-07-30T00:00:00Z"
    },
    {
      "absolute_delta": 0.0,
      "baseline_value": 0.96,
      "breach": false,
      "consecutive_breaches": 0,
      "current_value": 0.96,
      "metric": "faithfulness",
      "sample_count": 30,
      "state": "normal",
      "statistic": "jensen_shannon_divergence",
      "statistic_threshold": 0.1,
      "statistic_value": 0.0,
      "surface": "copilot",
      "threshold": 0.1,
      "window_end": "2026-07-30T00:39:00Z",
      "window_span_seconds": 1740.0,
      "window_start": "2026-07-30T00:10:00Z"
    },
    {
      "absolute_delta": 0.0,
      "baseline_value": 0.96,
      "breach": false,
      "consecutive_breaches": 0,
      "current_value": 0.96,
      "metric": "faithfulness",
      "sample_count": 30,
      "state": "normal",